<?xml version="1.0" encoding="UTF-8" standalone="no" ?>
<?codewarrior wizardversion="1.0" ideversion="5.2" ?>

<!DOCTYPE WIZARD SYSTEM "../wizard.dtd">

<WIZARD>
    <DIALOGLIST idref="ID_DLG_CHIP">
         <DIALOG id="ID_DLG_CHIP">
            <DIALOGITEMLIST>
                <DIALOGITEM presentationmode="Hide">
                    <WIZARDELEMENTREF idref="ID_INST_OSEK"></WIZARDELEMENTREF>
                </DIALOGITEM>
            </DIALOGITEMLIST>
        </DIALOG>
    </DIALOGLIST>
    <WIZARDELEMENTLIST>
        <WIZARDELEMENT name="" term="" id="ID_INST_OSEK"></WIZARDELEMENT>
    </WIZARDELEMENTLIST>
</WIZARD>
